[
    {
        "id": "Freak",
        "desc": "Freaky Dreaky.",
        "basetrait": true,
        "resist": [
            "fire",
            "poison"
        ],
        "el_absorbs": {
            "water": 1,
            "air": 0.5
        }
    },
    {
        "id": "Prostitute",
        "occupations": [
            "SIW"
        ],
        "desc": "Someone who will love you no matter who you are or what you look like.",
        "basetrait": true,
        "blocks": ["Virgin"],
        "mod": {
            "charisma": 60
        },
        "max": {
            "charisma": 30
        },
        "mod_skills": {
            "vaginal": [
                0.1,
                0.1,
                0.1
            ],
            "anal": [
                0.1,
                0.1,
                0.1
            ],
            "oral": [
                0.1,
                0.1,
                0.1
            ]
        },
        "type": "sex",
        "init_lvlmax": {
            "charisma": 30
        },
        "init_max": {
            "charisma": 30
        },
        "init_mod": {
            "charisma": 20
        },
        "init_skills": {
            "vaginal": [
                33,
                100
            ],
            "anal": [
                33,
                100
            ],
            "oral": [
                33,
                100
            ]
        },
        "leveling_stats": {
            "charisma": [
                0,
                1
            ]
        }
    },
    {
        "id": "Stripper",
        "occupations": [
            "SIW"
        ],
        "desc": "Stripper.",
        "basetrait": true
    },
    {
        "id": "Service",
        "occupations": [
            "Server"
        ],
        "desc": "Service.",
        "basetrait": true
    },
    {
        "id": "Mage",
        "occupations": [
            "Warrior"
        ],
        "desc": "Some simple desc of a mage.",
        "basetrait": true,
        "mod": {
            "magic": 100
        },
        "max": {
            "magic": 50
        },
        "mod_skills": {},
        "type": "combat",
        "init_lvlmax": {
            "magic": 100,
            "mp": 100
        },
        "init_max": {
            "magic": 100,
            "mp": 100
        },
        "init_mod": {
            "magic": 50
        },
        "init_skills": {},
        "leveling_stats": {
            "attack": [
                -2,
                -1
            ],
            "defence": [
                -2,
                -1
            ],
            "magic": [
                0,
                1
            ],
            "mp": [
                0,
                2
            ]
        }
    },
    {
        "id": "Warrior",
        "occupations": [
            "Warrior"
        ],
        "desc": "Some simple desc of a grunt.",
        "basetrait": true,
        "mod": {
            "attack": 100,
            "defence": 100
        },
        "max": {
            "attack": 50,
            "defence": 50
        },
        "mod_skills": {},
        "type": "combat",
        "init_lvlmax": {
            "attack": 100,
            "defence": 50,
            "health": 100
        },
        "init_max": {
            "attack": 100,
            "defence": 50,
            "health": 100
        },
        "init_mod": {
            "attack": 50,
            "defence": 25
        },
        "init_skills": {},
        "leveling_stats": {
            "attack": [
                0,
                2
            ],
            "defence": [
                0,
                1
            ],
            "health": [
                0,
                1
            ],
            "magic": [
                -2,
                -1
            ],
            "mp": [
                -2,
                -1
            ]
        }
    }
]
